{
  "name": "emberyear",
  "note": "INVENTED (not selected) by harness/author/invent-look.mjs from films/scene/_concepts/gh-wrapped.storyboard.md, seed 17, candidate 1 of 6. Stance \"ignition\": the year starts cold and catches fire, so the one warm colour IS the event. Ground is burnt ember (#170c0b), not neutral black: a year of work banked rather than a void. Texture is halation, the accent bleeds a little light into the ground and nothing else glows. Display face is a STENCIL, whose letters are interrupted by gaps, which is the subject said in type. The tool's own generated story line is preserved verbatim under `invented` and names the candidate's seed word, not this film.",
  "motion": {
    "easing": "easeOutExpo",
    "bounce": 0.1,
    "settle": 0.5,
    "enter": 30,
    "durationScale": 0.8,
    "stagger": 0.03,
    "exitRatio": 0.45
  },
  "bg": {
    "accent": "251,121,64",
    "tint": "50,25,17",
    "tint2": "73,36,23",
    "dotLight": "115,101,99",
    "paperBase": [
      "#ffffff",
      "#f4f5f8"
    ],
    "light": [
      "#ffffff",
      "#f4f5f8"
    ],
    "paper": "#ffffff",
    "softBase": [
      "#ffffff",
      "#eff0f3"
    ],
    "accentBase": [
      "#fff4f0",
      "#f4f5f8"
    ],
    "border": "#736563",
    "dark": [
      "#170c0b",
      "#0f0807"
    ],
    "deep": [
      "#170c0b",
      "#0c0606"
    ],
    "ink": [
      "#120a09",
      "#090504"
    ],
    "inkBase": [
      "#170c0b",
      "#0f0807"
    ],
    "darkMesh": [
      "#2e1710",
      "#0f0807"
    ]
  },
  "bgDefault": {
    "preset": "brandglow"
  },
  "vars": {
    "--ink": "#f6ecea",
    "--paper": "#170c0b",
    "--muted": "#afa4a3",
    "--em": "#fb7940",
    "--on-light": "#170c0b",
    "--on-dark": "#f6ecea",
    "--border": "#736563",
    "--accent-soft": "rgba(251,121,64,0.16)"
  },
  "invented": {
    "tool": "harness/author/invent-look.mjs",
    "storyboard": "films/scene/_concepts/gh-wrapped.storyboard.md",
    "subject": "GitHub wrapped, Vandit1604 · 20 Aug 2025 to 20 Aug 2026",
    "seed": 17,
    "resolvedSeed": 2725014791,
    "subjectFingerprint": 4169285043,
    "stance": "ignition",
    "story": "threadcite starts cold and catches fire, so the one warm colour IS the event",
    "texture": "halation: the accent bleeds a little light into the ground, and nothing else glows",
    "fonts": {
      "display": {
        "family": "Big Shoulders Stencil",
        "category": "Display",
        "variable": true,
        "weights": [
          100,
          200,
          300,
          400,
          500,
          600,
          700,
          800,
          900
        ]
      },
      "body": {
        "family": "Finlandica Text",
        "category": "Sans Serif",
        "variable": true,
        "weights": [
          100,
          200,
          300,
          400,
          500,
          600,
          700,
          800,
          900
        ]
      },
      "mono": {
        "family": "Datatype",
        "category": "Monospace",
        "variable": true,
        "weights": [
          100,
          200,
          300,
          400,
          500,
          600,
          700,
          800,
          900
        ]
      }
    },
    "chipGate": {
      "metric": "OKLab dE*100, 0.62*ground + 0.38*accent",
      "min": 16
    },
    "generated": "2026-08-20"
  },
  "tokens": {
    "color": {
      "bg": {
        "$type": "color",
        "$value": "#170c0b"
      },
      "bg2": {
        "$type": "color",
        "$value": "#1f1412"
      },
      "surface": {
        "$type": "color",
        "$value": "#241917"
      },
      "surface2": {
        "$type": "color",
        "$value": "#2c211f"
      },
      "line": {
        "$type": "color",
        "$value": "rgba(115,101,99,0.1)"
      },
      "lineStrong": {
        "$type": "color",
        "$value": "rgba(115,101,99,0.22)"
      },
      "text": {
        "$type": "color",
        "$value": "#f6ecea"
      },
      "text2": {
        "$type": "color",
        "$value": "#afa4a3"
      },
      "dim": {
        "$type": "color",
        "$value": "#7b716f"
      },
      "ink": {
        "$type": "color",
        "$value": "#f6ecea"
      },
      "accent": {
        "$type": "color",
        "$value": "#fb7940"
      },
      "accentDim": {
        "$type": "color",
        "$value": "rgba(251,121,64,0.16)"
      },
      "accentGlow": {
        "$type": "color",
        "$value": "rgba(251,121,64,0.45)"
      },
      "up": {
        "$type": "color",
        "$value": "#fb7940"
      },
      "down": {
        "$type": "color",
        "$value": "#cc3e66"
      }
    },
    "font": {
      "sans": {
        "$type": "fontFamily",
        "$value": "Finlandica Text"
      },
      "serif": {
        "$type": "fontFamily",
        "$value": "Big Shoulders Stencil"
      },
      "mono": {
        "$type": "fontFamily",
        "$value": "Datatype"
      },
      "num": {
        "$type": "fontFamily",
        "$value": "Datatype"
      }
    },
    "gradient": {
      "stop0": {
        "$type": "color",
        "$value": "#170c0b"
      },
      "stop1": {
        "$type": "color",
        "$value": "#25130e"
      },
      "stop2": {
        "$type": "color",
        "$value": "#0d0706"
      }
    }
  },
  "roles": {
    "ground": "{color.bg}",
    "bg2": "{color.bg2}",
    "surface": "{color.surface}",
    "surface2": "{color.surface2}",
    "line": "{color.line}",
    "lineStrong": "{color.lineStrong}",
    "text": "{color.text}",
    "text2": "{color.text2}",
    "dim": "{color.dim}",
    "ink": "{color.ink}",
    "accent": "{color.accent}",
    "accentDim": "{color.accentDim}",
    "accentGlow": "{color.accentGlow}",
    "up": "{color.up}",
    "down": "{color.down}",
    "font.sans": "{font.sans}",
    "font.serif": "{font.serif}",
    "font.mono": "{font.mono}",
    "font.num": "{font.num}",
    "gradient": [
      "{gradient.stop0}",
      "{gradient.stop1}",
      "{gradient.stop2}"
    ]
  }
}
